{"assets":{"cameraTimeline":"cinematic/camera-timelines.json","coverage":"provenance/coverage.json","navigation":"physics/world-navigation.json","route":"route/route-thread.glb","structuresCollision":"physics/structures-collision.glb","terrain":"terrain/surface/core-terrain.glb","terrainCollision":"physics/terrain-collision.glb","traversableSurfaces":"physics/traversable-surfaces.glb"},"coordinateReference":"route-local-enu-v1","explorationRadiusM":1600,"modes":["guided","free-roam"],"origin":{"elevationM":11.199999999999989,"latitude":35.69236423820257,"longitude":139.77525648660958},"quality":"core","routeId":"17665674778","schemaVersion":1,"worldId":"tokyo-urban"}
